{
  "schemaVersion": 1,
  "gate6Id": "gate6-20260710-01",
  "releaseEnvironment": "production",
  "runtimeEnvironment": "production",
  "drillMode": "supervised-production",
  "candidateSha": "aaaaaaaaaaaaaaaaaaaaaaaaaaaaaaaaaaaaaaaa",
  "candidateImageDigest": "sha256:bbbbbbbbbbbbbbbbbbbbbbbbbbbbbbbbbbbbbbbbbbbbbbbbbbbbbbbbbbbbbbbb",
  "rollbackSha": "cccccccccccccccccccccccccccccccccccccccc",
  "rollbackImageDigest": "sha256:dddddddddddddddddddddddddddddddddddddddddddddddddddddddddddddddd",
  "releaseManifestSha256": "eeeeeeeeeeeeeeeeeeeeeeeeeeeeeeeeeeeeeeeeeeeeeeeeeeeeeeeeeeeeeeee",
  "productionTargetDescriptorSha256": "ffffffffffffffffffffffffffffffffffffffffffffffffffffffffffffffff",
  "stagingTargetDescriptorSha256": "0000000000000000000000000000000000000000000000000000000000000000",
  "operatorBundleSha256": "1111111111111111111111111111111111111111111111111111111111111111",
  "installedOperatorBundleSha256": "1111111111111111111111111111111111111111111111111111111111111111",
  "topology": "split",
  "serviceSetSha256": "2222222222222222222222222222222222222222222222222222222222222222",
  "productionDatabaseFingerprint": "sha256:ffffffffffffffffffffffffffffffffffffffffffffffffffffffffffffffff",
  "productionProviderTargetFingerprints": [
    "sha256:1111111111111111111111111111111111111111111111111111111111111111"
  ],
  "composeProject": "spx-production",
  "envFile": "/root/SPX/.env",
  "composeFiles": [
    "/root/SPX/docker-compose.yml"
  ],
  "stagingBundles": {
    "task9Sha256": "2222222222222222222222222222222222222222222222222222222222222222",
    "workerSha256": "3333333333333333333333333333333333333333333333333333333333333333",
    "phase3Sha256": "4444444444444444444444444444444444444444444444444444444444444444",
    "phase4Sha256": "5555555555555555555555555555555555555555555555555555555555555555",
    "nMinusOneSha256": "6666666666666666666666666666666666666666666666666666666666666666"
  },
  "backupEvidenceSha256": "7777777777777777777777777777777777777777777777777777777777777777",
  "rpoMinutes": 5,
  "rtoMinutes": 20,
  "canaryTeamId": 2,
  "canaryEpoch": "gate6-ifn-20260710",
  "safeLineTargetSha256": "8888888888888888888888888888888888888888888888888888888888888888",
  "ocrFixtureSha256": "9999999999999999999999999999999999999999999999999999999999999999",
  "gate6Nonce": "nonce-20260710-01",
  "monitorThresholdsSha256": "0000000000000000000000000000000000000000000000000000000000000000",
  "protectedInstallEvidenceSha256": "aaaaaaaaaaaaaaaaaaaaaaaaaaaaaaaaaaaaaaaaaaaaaaaaaaaaaaaaaaaaaaaa",
  "installedMigrationSetSha256": "bbbbbbbbbbbbbbbbbbbbbbbbbbbbbbbbbbbbbbbbbbbbbbbbbbbbbbbbbbbbbbbb",
  "installedSchemaVersion": 44,
  "pendingReleasedMigrationCount": 0,
  "issuedAt": "2026-07-10T16:55:00.000Z",
  "expiresAt": "2026-07-10T18:00:00.000Z",
  "approver": "protected-environment-reviewer",
  "githubAttestation": {
    "repository": "owner/SPX",
    "environment": "production",
    "jobWorkflowRef": "owner/SPX/.github/workflows/gate6-envelope-signer.yml@aaaaaaaaaaaaaaaaaaaaaaaaaaaaaaaaaaaaaaaa",
    "jobWorkflowSha": "aaaaaaaaaaaaaaaaaaaaaaaaaaaaaaaaaaaaaaaa",
    "workflowFileSha256": "cccccccccccccccccccccccccccccccccccccccccccccccccccccccccccccccc",
    "workflowRunId": "123456",
    "issuer": "https://token.actions.githubusercontent.com",
    "audience": "spx-gate6",
    "artifactSha256": "aaaaaaaaaaaaaaaaaaaaaaaaaaaaaaaaaaaaaaaaaaaaaaaaaaaaaaaaaaaaaaaa"
  },
  "envelopeCoreSha256": "9fc887f666ed2419431dd4c014c4674be5febaab6085ee25c43f93552758ccf3",
  "actionIndexSha256": "54a99b70bf5076c4a973766c4987a40e38a14f5b520f18ef1700a833f5edfb5a",
  "actionApprovals": [
    {
      "gate6Id": "gate6-20260710-01",
      "scope": "gate6-admit",
      "kind": "forward",
      "actionId": "gate6-20260710-001",
      "envelopeCoreSha256": "9fc887f666ed2419431dd4c014c4674be5febaab6085ee25c43f93552758ccf3",
      "candidateSha": "aaaaaaaaaaaaaaaaaaaaaaaaaaaaaaaaaaaaaaaa",
      "runtimeEnvironment": "production",
      "drillMode": "supervised-production",
      "allowedMutationSha256": "0000000000000000000000000000000000000000000000000000000000000000",
      "rollbackScope": "gate6-admit:rollback",
      "pairedActionId": null,
      "issuedAt": "2026-07-10T16:55:00.000Z",
      "expiresAt": "2026-07-10T18:00:00.000Z",
      "signature": {
        "algorithm": "ed25519",
        "keyId": "gate6-production-test-fixture",
        "signedPayloadSha256": "2cf7363f81e56c82f3c3011d9a90535fe09ef5d56b97f389638cab79df8d4410",
        "signatureBase64": "HtCV4R58E42qJ1oC7EzhrjHkH0N0oqGmoXQ/kLVAwTe002ESt2UDZnrzJQu+GXOe39k9VEKwqsgYHaISA860CA=="
      }
    },
    {
      "gate6Id": "gate6-20260710-01",
      "scope": "stage-accept-db-transition",
      "kind": "forward",
      "actionId": "gate6-20260710-002",
      "envelopeCoreSha256": "9fc887f666ed2419431dd4c014c4674be5febaab6085ee25c43f93552758ccf3",
      "candidateSha": "aaaaaaaaaaaaaaaaaaaaaaaaaaaaaaaaaaaaaaaa",
      "runtimeEnvironment": "production",
      "drillMode": "supervised-production",
      "allowedMutationSha256": "1111111111111111111111111111111111111111111111111111111111111111",
      "rollbackScope": "stage-accept-db-transition:rollback",
      "pairedActionId": null,
      "issuedAt": "2026-07-10T16:55:00.000Z",
      "expiresAt": "2026-07-10T18:00:00.000Z",
      "signature": {
        "algorithm": "ed25519",
        "keyId": "gate6-production-test-fixture",
        "signedPayloadSha256": "5c58f9d6b8a1a22a8f8bb9955a02c6958bfcb6630f3f00cfd1569e2edd0296f1",
        "signatureBase64": "3hvXtij0fXtFgdplMUsQrZx2aXtalwgJxyhYia8YGv+NIcXtyK00FHNBROzycGO2JwdqFWWh7g8twh7JkHIMAA=="
      }
    },
    {
      "gate6Id": "gate6-20260710-01",
      "scope": "db-principal-prepare-realtime",
      "kind": "forward",
      "actionId": "gate6-20260710-003",
      "envelopeCoreSha256": "9fc887f666ed2419431dd4c014c4674be5febaab6085ee25c43f93552758ccf3",
      "candidateSha": "aaaaaaaaaaaaaaaaaaaaaaaaaaaaaaaaaaaaaaaa",
      "runtimeEnvironment": "production",
      "drillMode": "supervised-production",
      "allowedMutationSha256": "2222222222222222222222222222222222222222222222222222222222222222",
      "rollbackScope": "db-principal-prepare-realtime:rollback",
      "pairedActionId": null,
      "issuedAt": "2026-07-10T16:55:00.000Z",
      "expiresAt": "2026-07-10T18:00:00.000Z",
      "signature": {
        "algorithm": "ed25519",
        "keyId": "gate6-production-test-fixture",
        "signedPayloadSha256": "2ca8dfed96360cd23c5c8cbb529ef268be9c0c42ab685f0a562f594df18a73fb",
        "signatureBase64": "bI7hQ7R1DHFIOynZnOxfj9z72OnCv8CAHiRBedENN5nNTgVQViJHNuKoEq53Gi21wdEghgTqvNAsGAztokfwDw=="
      }
    },
    {
      "gate6Id": "gate6-20260710-01",
      "scope": "db-principal-prepare-line",
      "kind": "forward",
      "actionId": "gate6-20260710-004",
      "envelopeCoreSha256": "9fc887f666ed2419431dd4c014c4674be5febaab6085ee25c43f93552758ccf3",
      "candidateSha": "aaaaaaaaaaaaaaaaaaaaaaaaaaaaaaaaaaaaaaaa",
      "runtimeEnvironment": "production",
      "drillMode": "supervised-production",
      "allowedMutationSha256": "3333333333333333333333333333333333333333333333333333333333333333",
      "rollbackScope": "db-principal-prepare-line:rollback",
      "pairedActionId": null,
      "issuedAt": "2026-07-10T16:55:00.000Z",
      "expiresAt": "2026-07-10T18:00:00.000Z",
      "signature": {
        "algorithm": "ed25519",
        "keyId": "gate6-production-test-fixture",
        "signedPayloadSha256": "9bc1749d504401722ebd262de066afd967a51f3d1d0d827f2d42b233d8411da7",
        "signatureBase64": "xij/gE6TG++h1RmsB5z/Qj9Q3qAu1gcJufvzGsgZrcd9KJbKJEcbMaQQtXkXE9GN5qG3bfmUyPvTfzA8902+BA=="
      }
    },
    {
      "gate6Id": "gate6-20260710-01",
      "scope": "db-principal-prepare-notification",
      "kind": "forward",
      "actionId": "gate6-20260710-005",
      "envelopeCoreSha256": "9fc887f666ed2419431dd4c014c4674be5febaab6085ee25c43f93552758ccf3",
      "candidateSha": "aaaaaaaaaaaaaaaaaaaaaaaaaaaaaaaaaaaaaaaa",
      "runtimeEnvironment": "production",
      "drillMode": "supervised-production",
      "allowedMutationSha256": "4444444444444444444444444444444444444444444444444444444444444444",
      "rollbackScope": "db-principal-prepare-notification:rollback",
      "pairedActionId": null,
      "issuedAt": "2026-07-10T16:55:00.000Z",
      "expiresAt": "2026-07-10T18:00:00.000Z",
      "signature": {
        "algorithm": "ed25519",
        "keyId": "gate6-production-test-fixture",
        "signedPayloadSha256": "44547a8b2a749498a2baa04115430f36be4c82b6bb2205cbe9235a7ef1b38a74",
        "signatureBase64": "mkxMkbpgadBvyHo7+0NTZRJrF8ialCx2pTFR2Ng7M/S9JtIpBvfxjYwSElKriGPD7KfXeZFmWPYhPa85s2GJDQ=="
      }
    },
    {
      "gate6Id": "gate6-20260710-01",
      "scope": "db-principal-prepare-worker-ifn",
      "kind": "forward",
      "actionId": "gate6-20260710-006",
      "envelopeCoreSha256": "9fc887f666ed2419431dd4c014c4674be5febaab6085ee25c43f93552758ccf3",
      "candidateSha": "aaaaaaaaaaaaaaaaaaaaaaaaaaaaaaaaaaaaaaaa",
      "runtimeEnvironment": "production",
      "drillMode": "supervised-production",
      "allowedMutationSha256": "5555555555555555555555555555555555555555555555555555555555555555",
      "rollbackScope": "db-principal-prepare-worker-ifn:rollback",
      "pairedActionId": null,
      "issuedAt": "2026-07-10T16:55:00.000Z",
      "expiresAt": "2026-07-10T18:00:00.000Z",
      "signature": {
        "algorithm": "ed25519",
        "keyId": "gate6-production-test-fixture",
        "signedPayloadSha256": "400ffe5adec3d5b3d4bacce47ea2779ed39fce8db0f005e41a3cb79e5db19126",
        "signatureBase64": "KJeH4xiOzGYdi37CCluUCVbWjKOnWC+kPSBrGGRsEyOtwI6svx6ZfuB5e8qFRUxLLDSLZOxDUJvz+LvzKh6KDA=="
      }
    },
    {
      "gate6Id": "gate6-20260710-01",
      "scope": "db-principal-prepare-worker-ptwl",
      "kind": "forward",
      "actionId": "gate6-20260710-007",